{
	"name": "SaaS_Company_Drive",
	"description": "Centralized repository for all company documents, resources, and assets.",
	"version": "1.0.0",
	"last_updated": "2025-03-16T12:00:00Z",
	"organization": "SaaS Company",
	"metadata": {
		"purpose": "Standardized directory structure for SaaS companies to organize all business documents and resources",
		"governance": {
			"owner": "Operations Team",
			"review_cycle": "Quarterly"
		},
		"tags": ["saas", "cloud", "startup", "enterprise"]
	},
	"directories": [
		{
			"name": "01_Administrative",
			"display_name": "Administrative",
			"description": "Administrative documents including legal, HR, and financial resources.",
			"priority": 1,
			"access_level": "restricted",
			"retention_policy": "7 years for financial documents, permanent for legal documents",
			"readme_extra": {
				"usage_guidelines": "Store all administrative documents here. Ensure sensitive documents are properly secured with appropriate access controls.",
				"file_naming_convention": "YYYY-MM-DD_DocumentType_Description.ext",
				"contact_person": {
					"name": "Operations Manager",
					"role": "Head of Operations",
					"email": "operations@company.com",
					"slack_channel": "#operations"
				}
			},
			"subdirectories": [
				{
					"name": "Legal_Documents",
					"display_name": "Legal Documents",
					"description": "Legal documents including incorporation papers, contracts, compliance documentation, and intellectual property.",
					"access_level": "confidential",
					"retention_policy": "Permanent",
					"readme_extra": {
						"usage_guidelines": "This directory contains legally sensitive documents. Only authorized personnel should access or modify these files.",
						"file_naming_convention": "YYYY-MM-DD_Legal_[Type]_[Party]_[Description].pdf",
						"contact_person": {
							"name": "Legal Counsel",
							"role": "Legal Counsel",
							"email": "legal@company.com",
							"slack_channel": "#legal"
						}
					},
					"allowed_file_types": [".pdf", ".docx", ".xlsx"],
					"subdirectories": [
						{
							"name": "Incorporation_and_Business_Formation",
							"display_name": "Incorporation and Business Formation",
							"description": "Documents related to company incorporation, business registration, and formation.",
							"access_level": "confidential"
						},
						{
							"name": "Contracts",
							"display_name": "Contracts",
							"description": "All company contracts including vendor agreements, client contracts, and partnerships.",
							"access_level": "confidential",
							"readme_extra": {
								"file_naming_convention": "YYYY-MM-DD_[ContractType]_[PartyName].pdf"
							}
						},
						{
							"name": "Intellectual_Property",
							"display_name": "Intellectual Property",
							"description": "Patents, trademarks, copyrights, and other intellectual property documentation.",
							"access_level": "confidential"
						},
						{
							"name": "Compliance",
							"display_name": "Compliance",
							"description": "Regulatory compliance documentation, certifications, and audit reports.",
							"access_level": "confidential"
						}
					]
				},
				{
					"name": "HR_and_People",
					"display_name": "HR and People",
					"description": "Human resources documentation including employee handbooks, hiring resources, benefits information, and team policies.",
					"access_level": "restricted",
					"readme_extra": {
						"usage_guidelines": "Contains sensitive employee information. Access restricted to HR team and management.",
						"contact_person": {
							"name": "HR Director",
							"role": "HR Director",
							"email": "hr@company.com",
							"slack_channel": "#hr-team"
						}
					},
					"subdirectories": [
						{
							"name": "Employee_Handbook",
							"display_name": "Employee Handbook",
							"description": "Current and past versions of the employee handbook.",
							"access_level": "team"
						},
						{
							"name": "Hiring_and_Recruiting",
							"display_name": "Hiring and Recruiting",
							"description": "Job descriptions, interview templates, and recruiting resources.",
							"access_level": "restricted"
						},
						{
							"name": "Onboarding",
							"display_name": "Onboarding",
							"description": "Employee onboarding materials, checklists, and resources.",
							"access_level": "team"
						},
						{
							"name": "Benefits_and_Compensation",
							"display_name": "Benefits and Compensation",
							"description": "Benefits information, compensation structures, and related documentation.",
							"access_level": "confidential"
						},
						{
							"name": "Performance_Reviews",
							"display_name": "Performance Reviews",
							"description": "Performance review templates, guidelines, and historical data.",
							"access_level": "confidential"
						}
					]
				},
				{
					"name": "Finance_and_Accounting",
					"display_name": "Finance and Accounting",
					"description": "Financial documentation including budgets, investor reports, expense tracking, and fundraising materials.",
					"access_level": "confidential",
					"retention_policy": "7 years minimum, or as required by law",
					"readme_extra": {
						"usage_guidelines": "Store all financial documents here. Highly sensitive information with restricted access.",
						"contact_person": {
							"name": "Finance Director",
							"role": "Finance Director",
							"email": "finance@company.com",
							"slack_channel": "#finance"
						}
					},
					"subdirectories": [
						{
							"name": "Budgets_and_Forecasts",
							"display_name": "Budgets and Forecasts",
							"description": "Company budgets, financial forecasts, and planning documents.",
							"access_level": "confidential"
						},
						{
							"name": "Investor_Relations",
							"display_name": "Investor Relations",
							"description": "Investor reports, pitch decks, and fundraising materials.",
							"access_level": "confidential"
						},
						{
							"name": "Tax_Documents",
							"display_name": "Tax Documents",
							"description": "Tax filings, documentation, and related correspondence.",
							"access_level": "confidential",
							"retention_policy": "7 years minimum, or as required by tax authorities"
						},
						{
							"name": "Financial_Statements",
							"display_name": "Financial Statements",
							"description": "Balance sheets, income statements, cash flow statements, and other financial reports.",
							"access_level": "confidential"
						}
					]
				}
			]
		},
		{
			"name": "02_Product",
			"display_name": "Product",
			"description": "Product development materials, including research, specifications, design, and roadmaps.",
			"priority": 1,
			"access_level": "team",
			"readme_extra": {
				"usage_guidelines": "Central repository for all product development activities. Follow proper versioning for all design documents.",
				"contact_person": {
					"name": "Product Lead",
					"role": "VP of Product",
					"email": "product@company.com",
					"slack_channel": "#product-team"
				}
			},
			"subdirectories": [
				{
					"name": "Research",
					"display_name": "Research",
					"description": "Market research, user research, competitive analysis, and other research materials.",
					"access_level": "team",
					"subdirectories": [
						{
							"name": "Market_Research",
							"display_name": "Market Research",
							"description": "Market analysis, industry trends, and market opportunity assessments."
						},
						{
							"name": "User_Research",
							"display_name": "User Research",
							"description": "User interviews, surveys, usability studies, and other user research materials."
						},
						{
							"name": "Competitive_Analysis",
							"display_name": "Competitive Analysis",
							"description": "Analysis of competitors, feature comparisons, and competitive positioning."
						}
					]
				},
				{
					"name": "Product_Strategy",
					"display_name": "Product Strategy",
					"description": "Product vision, strategy documents, and long-term planning materials.",
					"access_level": "team",
					"subdirectories": [
						{
							"name": "Vision_and_Strategy",
							"display_name": "Vision and Strategy",
							"description": "Product vision statements, strategic plans, and long-term objectives."
						},
						{
							"name": "Roadmaps",
							"display_name": "Roadmaps",
							"description": "Product roadmaps, release plans, and feature prioritization documents.",
							"readme_extra": {
								"file_naming_convention": "YYYY-MM_[ProductName]_Roadmap_v[Version].ext"
							}
						}
					]
				},
				{
					"name": "Product_Design",
					"display_name": "Product Design",
					"description": "UI/UX designs, wireframes, mockups, and design systems.",
					"access_level": "team",
					"subdirectories": [
						{
							"name": "Wireframes",
							"display_name": "Wireframes",
							"description": "Low-fidelity wireframes and user flow diagrams."
						},
						{
							"name": "UI_Designs",
							"display_name": "UI Designs",
							"description": "High-fidelity UI designs and mockups.",
							"readme_extra": {
								"file_naming_convention": "YYYY-MM-DD_[Feature]_[Screen]_v[Version].ext"
							}
						},
						{
							"name": "Design_System",
							"display_name": "Design System",
							"description": "Design system components, guidelines, and assets."
						},
						{
							"name": "Prototypes",
							"display_name": "Prototypes",
							"description": "Interactive prototypes and demo materials."
						}
					]
				},
				{
					"name": "Product_Requirements",
					"display_name": "Product Requirements",
					"description": "Product requirements documents, specifications, and user stories.",
					"access_level": "team",
					"readme_extra": {
						"file_naming_convention": "YYYY-MM-DD_[Feature]_PRD_v[Version].ext"
					},
					"subdirectories": [
						{
							"name": "PRDs",